{
  "schemaVersion": "0.1.0",
  "cityId": "torrevieja",
  "cityName": "Torrevieja",
  "sourceResearchState": {
    "stage": "city-reviewed",
    "baselineCompleted": true,
    "cityResearchCompleted": true,
    "lastResearchDate": "2026-10-06",
    "completeness": "substantial",
    "openQuestions": [
      "Exact boundaries among named urbanizations, cadastral value zones and morphological transitions still do not coincide cleanly; V0 district/zone polygons remain research approximations.",
      "Current built-height distribution for coastal slabs/towers remains weak: planning maxima in La Veleta/Molino Blanco cannot substitute for a measured current-building survey.",
      "Development-level facade/window/balcony rhythms and material palettes remain under-documented outside the broad municipal landscape descriptions.",
      "Representative villa/terrace compound samples are still needed to quantify how roof, pool, garden-wall and porch treatments vary by individual urbanization without destroying local repetition.",
      "La Hoya, La Manguilla, Los Locos and the port/Eras projects are changing during 2026; future-state planning must continue to be kept separate from completed current form.",
      "The future Museo del Mar y de la Sal at Eras de la Sal is not current built form as of 5 October 2026; the current provisional museum remains at C. Patricio Pérez 10.",
      "Completion and exact current appearance of the Muelle Mínguez recovery works were not independently confirmed in this pass.",
      "The saltworks should be represented as a unique industrial landscape, but exact operational plant geometry/material details remain intentionally unresolved where not necessary for city-scale representation.",
      "The retained baseline building ID bldg-torrevieja-landmark-plaza-constitucion is semantic legacy debt: it came from a place landmark rather than a discrete building. Schema v0.1 has no retired-record state, so it is retained and explicitly downgraded rather than silently deleted."
    ]
  },
  "auditStage": "phase2-maturity-audit",
  "overallMaturity": "substantial-derivation-ready",
  "completionQuestions": {
    "dominantFamiliesByMajorZone": true,
    "repetitionBehaviorKnown": true,
    "sharedVsCitySpecificReuseKnown": true,
    "bespokeNamedStructuresIdentified": true,
    "identityPoisIdentified": true,
    "evidenceBackedTraitsAvailable": true,
    "uncertaintiesExplicit": true
  },
  "zoneSummary": {
    "total": 31,
    "derivation-ready": 15,
    "derivation-ready-with-nonblocking-gap": 16
  },
  "dominantRecurringFamilies": [
    {
      "buildingId": "bldg-torrevieja-lowrise-compound",
      "name": "Low-rise apartment / communal compound",
      "reuseScope": "city-specific",
      "recommendedTreatment": "city-variant",
      "repetitionBehavior": "locally-repetitive",
      "frequency": "common",
      "sharedFamilyId": null,
      "sharedFamilyName": null,
      "researchStage": "city-reresearch",
      "confidence": "medium",
      "linkedZoneCount": 23
    },
    {
      "buildingId": "bldg-torrevieja-midrise-apartment",
      "name": "Mid-rise apartment block",
      "reuseScope": "shared",
      "recommendedTreatment": "shared-kit",
      "repetitionBehavior": "locally-repetitive",
      "frequency": "dominant",
      "sharedFamilyId": "arch-neighborhood-midrise-apartment",
      "sharedFamilyName": "Neighborhood mid-rise apartment block",
      "researchStage": "city-reresearch",
      "confidence": "medium",
      "linkedZoneCount": 19
    },
    {
      "buildingId": "bldg-torrevieja-terrace-bungalow",
      "name": "Terrace / semi-detached bungalow family",
      "reuseScope": "regional",
      "recommendedTreatment": "regional-variant",
      "repetitionBehavior": "highly-repetitive",
      "frequency": "common",
      "sharedFamilyId": "arch-lowrise-rowhouse-townhouse",
      "sharedFamilyName": "Low-rise terrace / townhouse / semi-detached family",
      "researchStage": "city-reresearch",
      "confidence": "high",
      "linkedZoneCount": 19
    },
    {
      "buildingId": "bldg-torrevieja-detached-villa",
      "name": "Detached Mediterranean villa",
      "reuseScope": "regional",
      "recommendedTreatment": "regional-variant",
      "repetitionBehavior": "highly-repetitive",
      "frequency": "dominant",
      "sharedFamilyId": "arch-detached-mediterranean-house",
      "sharedFamilyName": "Detached Mediterranean house / villa",
      "researchStage": "city-reresearch",
      "confidence": "high",
      "linkedZoneCount": 17
    },
    {
      "buildingId": "bldg-torrevieja-coastal-slab-tower",
      "name": "Coastal slab / tower apartment",
      "reuseScope": "regional",
      "recommendedTreatment": "regional-variant",
      "repetitionBehavior": "locally-repetitive",
      "frequency": "common",
      "sharedFamilyId": "arch-coastal-apartment-slab-tower",
      "sharedFamilyName": "Coastal apartment slab / tower",
      "researchStage": "city-reresearch",
      "confidence": "medium",
      "linkedZoneCount": 7
    },
    {
      "buildingId": "bldg-torrevieja-central-mixed",
      "name": "Central mixed-use urban block",
      "reuseScope": "shared",
      "recommendedTreatment": "shared-kit",
      "repetitionBehavior": "locally-repetitive",
      "frequency": "common",
      "sharedFamilyId": "arch-central-mixed-midrise",
      "sharedFamilyName": "Central mixed-use mid-rise block",
      "researchStage": "city-reresearch",
      "confidence": "medium",
      "linkedZoneCount": 6
    },
    {
      "buildingId": "bldg-torrevieja-commercial-box",
      "name": "Large-format retail box",
      "reuseScope": "shared",
      "recommendedTreatment": "shared-kit",
      "repetitionBehavior": "locally-repetitive",
      "frequency": "common",
      "sharedFamilyId": "arch-large-commercial-box",
      "sharedFamilyName": "Large-format commercial / retail box",
      "researchStage": "baseline",
      "confidence": "high",
      "linkedZoneCount": 6
    },
    {
      "buildingId": "bldg-torrevieja-emerging-midrise",
      "name": "Emerging planned residential block",
      "reuseScope": "city-specific",
      "recommendedTreatment": "city-variant",
      "repetitionBehavior": "mixed",
      "frequency": "common",
      "sharedFamilyId": null,
      "sharedFamilyName": null,
      "researchStage": "city-reresearch",
      "confidence": "low",
      "linkedZoneCount": 3
    }
  ],
  "bespokeBuildingCount": 15,
  "bespokeBuildings": [
    {
      "id": "bldg-torrevieja-landmark-bus-station",
      "name": "Estación de Autobuses de Torrevieja",
      "priority": "high"
    },
    {
      "id": "bldg-torrevieja-landmark-torre-moro",
      "name": "Torre del Moro",
      "priority": "critical"
    },
    {
      "id": "bldg-torrevieja-landmark-palacio-deportes",
      "name": "Palacio de los Deportes de Torrevieja",
      "priority": "high"
    },
    {
      "id": "bldg-torrevieja-landmark-hospital-quiron",
      "name": "Hospital Quirónsalud Torrevieja",
      "priority": "high"
    },
    {
      "id": "bldg-torrevieja-landmark-auditorio-internacional",
      "name": "Auditorio Internacional de Torrevieja",
      "priority": "high"
    },
    {
      "id": "bldg-torrevieja-landmark-habaneras",
      "name": "Centro Comercial Habaneras",
      "priority": "high"
    },
    {
      "id": "bldg-torrevieja-landmark-hospital-universitario",
      "name": "Hospital Universitario de Torrevieja",
      "priority": "high"
    },
    {
      "id": "bldg-torrevieja-landmark-torre-la-mata",
      "name": "Torre de La Mata",
      "priority": "high"
    },
    {
      "id": "bldg-torrevieja-landmark-inmaculada",
      "name": "Iglesia de la Inmaculada Concepción",
      "priority": "critical"
    },
    {
      "id": "bldg-torrevieja-landmark-rosario-la-mata",
      "name": "Iglesia de Nuestra Señora del Rosario",
      "priority": "high"
    },
    {
      "id": "bldg-torrevieja-landmark-sagrado-corazon",
      "name": "Iglesia del Sagrado Corazón de Jesús",
      "priority": "high"
    },
    {
      "id": "bldg-torrevieja-landmark-teatro-municipal",
      "name": "Teatro Municipal de Torrevieja",
      "priority": "high"
    },
    {
      "id": "bldg-torrevieja-landmark-eras-caballete",
      "name": "Caballete de las Eras de la Sal",
      "priority": "critical"
    }
  ],
  "identityPoiCount": 28,
  "identityPois": [
    {
      "id": "poi-torrevieja-plaza-constitucion",
      "name": "Plaza de la Constitución",
      "type": "civic",
      "importance": "characteristic",
      "treatment": "bespoke-object"
    },
    {
      "id": "poi-torrevieja-eras-sal",
      "name": "Eras de la Sal",
      "type": "heritage",
      "importance": "city-defining",
      "treatment": "bespoke-complex"
    },
    {
      "id": "poi-torrevieja-port",
      "name": "Puerto de Torrevieja",
      "type": "port",
      "importance": "city-defining",
      "treatment": "bespoke-complex"
    },
    {
      "id": "poi-torrevieja-bus-station",
      "name": "Estación de Autobuses de Torrevieja",
      "type": "transport",
      "importance": "characteristic",
      "treatment": "bespoke-object"
    },
    {
      "id": "poi-torrevieja-parque-naciones",
      "name": "Parque de las Naciones",
      "type": "recreation",
      "importance": "characteristic",
      "treatment": "landscape-feature"
    },
    {
      "id": "poi-torrevieja-museo-mar-sal",
      "name": "Museo del Mar y de la Sal",
      "type": "cultural",
      "importance": "characteristic",
      "treatment": "bespoke-object"
    },
    {
      "id": "poi-torrevieja-playa-locos",
      "name": "Playa de Los Locos",
      "type": "tourism",
      "importance": "characteristic",
      "treatment": "landscape-feature"
    },
    {
      "id": "poi-torrevieja-playa-naufragos",
      "name": "Playa de los Náufragos",
      "type": "tourism",
      "importance": "characteristic",
      "treatment": "landscape-feature"
    },
    {